<?xml version="1.0" encoding="UTF-8"?>
<!--
To change this template, choose Tools | Templates
and open the template in the editor.
-->


<ns1:Message
    xmlns:xsi='http://www.w3.org/2001/XMLSchema-instance'
   xsi:noNamespaceSchemaLocation="message2.xsd">
    <notes>
        <id></id>
        <from></from>
        <to></to>
        <heading></heading>
        <senddate></senddate>
        <body></body>
        <lang>es</lang>
    </notes>
    <notes>
        <id></id>
        <from></from>
        <to></to>
        <heading></heading>
        <senddate></senddate>
        <body></body>
        <lang></lang>
    </notes>
    <notes>
        <id></id>
        <from></from>
        <to></to>
        <heading></heading>
        <senddate></senddate>
        <body></body>
        <lang></lang>
    </notes>

</ns1:Message>
